GBE_category	GBE_ID	N	GBE_NAME	GBE_short_name	GBE_short_name_len
INI	INI24003	11696	Nitrogen_dioxide_air_pollution;_2010	NO2 air poll. 2010	18
INI	INI24004	11696	Nitrogen_oxides_air_pollution;_2010	Nitrogen oxides air poll. 2010	30
INI	INI24005	11079	Particulate_matter_air_pollution_(pm10);_2010	Air poll. (pm10) 2010	21
INI	INI24006	11079	Particulate_matter_air_pollution_(pm2.5);_2010	Air poll. (pm2.5) 2010	22
INI	INI24007	11079	Particulate_matter_air_pollution_(pm2.5)_absorbance;_2010	Air poll. (pm2.5) absorbance 2010	33
INI	INI24008	11079	Particulate_matter_air_pollution_2.5-10um;_2010	Air poll. 2.5-10um 2010	23
INI	INI24009	11696	Traffic_intensity_on_the_nearest_road	Traffic intensity on the nearest road	37
INI	INI24010	11696	Inverse_distance_to_the_nearest_road	Inverse dist. to the nearest road	33
INI	INI24011	11696	Traffic_intensity_on_the_nearest_major_road	Traffic intensity on the nearest major road	43
INI	INI24012	11696	Inverse_distance_to_the_nearest_major_road	Inverse dist. to the nearest major road	39
INI	INI24013	11696	Total_traffic_load_on_major_roads	Total traffic load on major roads	33
INI	INI24015	11696	Sum_of_road_length_of_major_roads_within_100m	Sum of road length of major roads within 100m	45
INI	INI24016	11696	Nitrogen_dioxide_air_pollution;_2005	NO2 air poll. 2005	18
INI	INI24017	11696	Nitrogen_dioxide_air_pollution;_2006	NO2 air poll. 2006	18
INI	INI24018	11696	Nitrogen_dioxide_air_pollution;_2007	NO2 air poll. 2007	18
INI	INI24019	11679	Particulate_matter_air_pollution_(pm10);_2007	Air poll. (pm10) 2007	21
INI	INI24020	11696	Average_daytime_sound_level_of_noise_pollution	Ave. daytime noise lvl.	23
INI	INI24021	11696	Average_evening_sound_level_of_noise_pollution	Ave. evening noise lvl.	23
INI	INI24022	11696	Average_night-time_sound_level_of_noise_pollution	Ave. nighttime noise lvl.	25
INI	INI24023	11696	Average_16-hour_sound_level_of_noise_pollution	Ave. 16-hour noise lvl.	23
INI	INI24024	11696	Average_24-hour_sound_level_of_noise_pollution	Ave. 24-hour noise lvl.	23
INI	INI2405	5192	Number_of_children_fathered	# of children fathered	22
INI	INI25000	1169	Volumetric_scaling_from_T1_head_image_to_standard_space	Volumetric scaling from T1 head image to standard space	55
INI	INI25001	1169	Volume_of_peripheral_cortical_grey_matter_(normalised_for_head_size)	Vol. of peripheral cortical grey matter (normalised for head size)	66
INI	INI25002	1169	Volume_of_peripheral_cortical_grey_matter	Vol. of peripheral cortical grey matter	39
INI	INI25003	1169	Volume_of_ventricular_cerebrospinal_fluid_(normalised_for_head_size)	Vol. of ventricular cerebrospinal fluid (normalised for head size)	66
INI	INI25004	1169	Volume_of_ventricular_cerebrospinal_fluid	Vol. of ventricular cerebrospinal fluid	39
INI	INI25005	1169	Volume_of_grey_matter_(normalised_for_head_size)	Vol. of grey matter (normalised for head size)	46
INI	INI25006	1169	Volume_of_grey_matter	Vol. of grey matter	19
INI	INI25007	1169	Volume_of_white_matter_(normalised_for_head_size)	Vol. of white matter (normalised for head size)	47
INI	INI25008	1169	Volume_of_white_matter	Vol. of white matter	20
INI	INI25009	1169	Volume_of_brain,_grey+white_matter_(normalised_for_head_size)	Vol. of brain, grey+white matter (normalised for head size)	59
INI	INI25010	1169	Volume_of_brain,_grey+white_matter	Vol. of brain, grey+white matter	32
INI	INI25011	1167	Volume_of_thalamus_(left)	Vol. of thalamus (L)	20
INI	INI25012	1167	Volume_of_thalamus_(right)	Vol. of thalamus (R)	20
INI	INI25013	1167	Volume_of_caudate_(left)	Vol. of caudate (L)	19
INI	INI25014	1167	Volume_of_caudate_(right)	Vol. of caudate (R)	19
INI	INI25015	1167	Volume_of_putamen_(left)	Vol. of putamen (L)	19
INI	INI25016	1167	Volume_of_putamen_(right)	Vol. of putamen (R)	19
INI	INI25017	1167	Volume_of_pallidum_(left)	Vol. of pallidum (L)	20
INI	INI25018	1167	Volume_of_pallidum_(right)	Vol. of pallidum (R)	20
INI	INI25019	1167	Volume_of_hippocampus_(left)	Vol. of hippocampus (L)	23
INI	INI25020	1167	Volume_of_hippocampus_(right)	Vol. of hippocampus (R)	23
INI	INI25021	1167	Volume_of_amygdala_(left)	Vol. of amygdala (L)	20
INI	INI25022	1167	Volume_of_amygdala_(right)	Vol. of amygdala (R)	20
INI	INI25023	1167	Volume_of_accumbens_(left)	Vol. of accumbens (L)	21
INI	INI25024	1167	Volume_of_accumbens_(right)	Vol. of accumbens (R)	21
INI	INI25025	1167	Volume_of_brain_stem_+_4th_ventricle	Vol. of brain stem + 4th ventricle	34
INI	INI25026	1041	Median_T2star_in_thalamus_(left)	Median T2star in thalamus (L)	29
INI	INI25027	1041	Median_T2star_in_thalamus_(right)	Median T2star in thalamus (R)	29
INI	INI25028	1041	Median_T2star_in_caudate_(left)	Median T2star in caudate (L)	28
INI	INI25029	1041	Median_T2star_in_caudate_(right)	Median T2star in caudate (R)	28
INI	INI25030	1041	Median_T2star_in_putamen_(left)	Median T2star in putamen (L)	28
INI	INI25031	1041	Median_T2star_in_putamen_(right)	Median T2star in putamen (R)	28
INI	INI25032	1041	Median_T2star_in_pallidum_(left)	Median T2star in pallidum (L)	29
INI	INI25033	1041	Median_T2star_in_pallidum_(right)	Median T2star in pallidum (R)	29
INI	INI25034	1041	Median_T2star_in_hippocampus_(left)	Median T2star in hippocampus (L)	32
INI	INI25035	1041	Median_T2star_in_hippocampus_(right)	Median T2star in hippocampus (R)	32
INI	INI25036	1041	Median_T2star_in_amygdala_(left)	Median T2star in amygdala (L)	29
INI	INI25037	1041	Median_T2star_in_amygdala_(right)	Median T2star in amygdala (R)	29
INI	INI25038	1041	Median_T2star_in_accumbens_(left)	Median T2star in accumbens (L)	30
INI	INI25039	1041	Median_T2star_in_accumbens_(right)	Median T2star in accumbens (R)	30
INI	INI25040	980	Median_BOLD_effect_(in_group-defined_mask)_for_shapes_activation	Median BOLD effect (in group-defined mask) for shapes activation	64
INI	INI25042	980	Median_z-statistic_(in_group-defined_mask)_for_shapes_activation	Median z-stat. (in group-defined mask) for shapes activation	60
INI	INI25044	980	Median_BOLD_effect_(in_group-defined_mask)_for_faces_activation	Median BOLD effect (in group-defined mask) for faces activation	63
INI	INI25046	980	Median_z-statistic_(in_group-defined_mask)_for_faces_activation	Median z-stat. (in group-defined mask) for faces activation	59
INI	INI25048	980	Median_BOLD_effect_(in_group-defined_mask)_for_faces-shapes_contrast	Median BOLD effect (in group-defined mask) for faces-shapes contrast	68
INI	INI25050	980	Median_z-statistic_(in_group-defined_mask)_for_faces-shapes_contrast	Median z-stat. (in group-defined mask) for faces-shapes contrast	64
INI	INI25052	980	Median_BOLD_effect_(in_group-defined_amygdala_activation_mask)_for_faces-shapes_contrast	Median BOLD effect (in group-defined amygdala activation mask) for faces-shapes contrast	88
INI	INI25054	980	Median_z-statistic_(in_group-defined_amygdala_activation_mask)_for_faces-shapes_contrast	Median z-stat. (in group-defined amygdala activation mask) for faces-shapes contrast	84
INI	INI25056	1063	Mean_FA_in_middle_cerebellar_peduncle_on_FA_skeleton	Mean FA in middle cerebellar peduncle on FA skeleton	52
INI	INI25057	1063	Mean_FA_in_pontine_crossing_tract_on_FA_skeleton	Mean FA in pontine crossing tract on FA skeleton	48
INI	INI25058	1063	Mean_FA_in_genu_of_corpus_callosum_on_FA_skeleton	Mean FA in genu of corpus callosum on FA skeleton	49
INI	INI25059	1063	Mean_FA_in_body_of_corpus_callosum_on_FA_skeleton	Mean FA in body of corpus callosum on FA skeleton	49
INI	INI25060	1063	Mean_FA_in_splenium_of_corpus_callosum_on_FA_skeleton	Mean FA in splenium of corpus callosum on FA skeleton	53
INI	INI25061	1063	Mean_FA_in_fornix_on_FA_skeleton	Mean FA in fornix on FA skeleton	32
INI	INI25062	1063	Mean_FA_in_corticospinal_tract_on_FA_skeleton_(right)	Mean FA in corticospinal tract on FA skeleton (R)	49
INI	INI25063	1063	Mean_FA_in_corticospinal_tract_on_FA_skeleton_(left)	Mean FA in corticospinal tract on FA skeleton (L)	49
INI	INI25064	1063	Mean_FA_in_medial_lemniscus_on_FA_skeleton_(right)	Mean FA in medial lemniscus on FA skeleton (R)	46
INI	INI25065	1063	Mean_FA_in_medial_lemniscus_on_FA_skeleton_(left)	Mean FA in medial lemniscus on FA skeleton (L)	46
INI	INI25066	1063	Mean_FA_in_inferior_cerebellar_peduncle_on_FA_skeleton_(right)	Mean FA in inferior cerebellar peduncle on FA skeleton (R)	58
INI	INI25067	1063	Mean_FA_in_inferior_cerebellar_peduncle_on_FA_skeleton_(left)	Mean FA in inferior cerebellar peduncle on FA skeleton (L)	58
INI	INI25068	1063	Mean_FA_in_superior_cerebellar_peduncle_on_FA_skeleton_(right)	Mean FA in superior cerebellar peduncle on FA skeleton (R)	58
INI	INI25069	1063	Mean_FA_in_superior_cerebellar_peduncle_on_FA_skeleton_(left)	Mean FA in superior cerebellar peduncle on FA skeleton (L)	58
INI	INI25070	1063	Mean_FA_in_cerebral_peduncle_on_FA_skeleton_(right)	Mean FA in cerebral peduncle on FA skeleton (R)	47
INI	INI25071	1063	Mean_FA_in_cerebral_peduncle_on_FA_skeleton_(left)	Mean FA in cerebral peduncle on FA skeleton (L)	47
INI	INI25072	1063	Mean_FA_in_anterior_limb_of_internal_capsule_on_FA_skeleton_(right)	Mean FA in anterior limb of internal capsule on FA skeleton (R)	63
INI	INI25073	1063	Mean_FA_in_anterior_limb_of_internal_capsule_on_FA_skeleton_(left)	Mean FA in anterior limb of internal capsule on FA skeleton (L)	63
INI	INI25074	1063	Mean_FA_in_posterior_limb_of_internal_capsule_on_FA_skeleton_(right)	Mean FA in posterior limb of internal capsule on FA skeleton (R)	64
INI	INI25075	1063	Mean_FA_in_posterior_limb_of_internal_capsule_on_FA_skeleton_(left)	Mean FA in posterior limb of internal capsule on FA skeleton (L)	64
INI	INI25076	1063	Mean_FA_in_retrolenticular_part_of_internal_capsule_on_FA_skeleton_(right)	Mean FA in retrolenticular part of internal capsule on FA skeleton (R)	70
INI	INI25077	1063	Mean_FA_in_retrolenticular_part_of_internal_capsule_on_FA_skeleton_(left)	Mean FA in retrolenticular part of internal capsule on FA skeleton (L)	70
INI	INI25078	1063	Mean_FA_in_anterior_corona_radiata_on_FA_skeleton_(right)	Mean FA in anterior corona radiata on FA skeleton (R)	53
INI	INI25079	1063	Mean_FA_in_anterior_corona_radiata_on_FA_skeleton_(left)	Mean FA in anterior corona radiata on FA skeleton (L)	53
INI	INI25080	1063	Mean_FA_in_superior_corona_radiata_on_FA_skeleton_(right)	Mean FA in superior corona radiata on FA skeleton (R)	53
INI	INI25081	1063	Mean_FA_in_superior_corona_radiata_on_FA_skeleton_(left)	Mean FA in superior corona radiata on FA skeleton (L)	53
INI	INI25082	1063	Mean_FA_in_posterior_corona_radiata_on_FA_skeleton_(right)	Mean FA in posterior corona radiata on FA skeleton (R)	54
INI	INI25083	1063	Mean_FA_in_posterior_corona_radiata_on_FA_skeleton_(left)	Mean FA in posterior corona radiata on FA skeleton (L)	54
INI	INI25084	1063	Mean_FA_in_posterior_thalamic_radiation_on_FA_skeleton_(right)	Mean FA in posterior thalamic radiation on FA skeleton (R)	58
INI	INI25085	1063	Mean_FA_in_posterior_thalamic_radiation_on_FA_skeleton_(left)	Mean FA in posterior thalamic radiation on FA skeleton (L)	58
INI	INI25086	1063	Mean_FA_in_sagittal_stratum_on_FA_skeleton_(right)	Mean FA in sagittal stratum on FA skeleton (R)	46
INI	INI25087	1063	Mean_FA_in_sagittal_stratum_on_FA_skeleton_(left)	Mean FA in sagittal stratum on FA skeleton (L)	46
INI	INI25088	1063	Mean_FA_in_external_capsule_on_FA_skeleton_(right)	Mean FA in external capsule on FA skeleton (R)	46
INI	INI25089	1063	Mean_FA_in_external_capsule_on_FA_skeleton_(left)	Mean FA in external capsule on FA skeleton (L)	46
INI	INI25090	1063	Mean_FA_in_cingulum_cingulate_gyrus_on_FA_skeleton_(right)	Mean FA in cingulum cingulate gyrus on FA skeleton (R)	54
INI	INI25091	1063	Mean_FA_in_cingulum_cingulate_gyrus_on_FA_skeleton_(left)	Mean FA in cingulum cingulate gyrus on FA skeleton (L)	54
INI	INI25092	1063	Mean_FA_in_cingulum_hippocampus_on_FA_skeleton_(right)	Mean FA in cingulum hippocampus on FA skeleton (R)	50
INI	INI25093	1063	Mean_FA_in_cingulum_hippocampus_on_FA_skeleton_(left)	Mean FA in cingulum hippocampus on FA skeleton (L)	50
INI	INI25094	1063	Mean_FA_in_fornix_cres+stria_terminalis_on_FA_skeleton_(right)	Mean FA in fornix cres+stria terminalis on FA skeleton (R)	58
INI	INI25095	1063	Mean_FA_in_fornix_cres+stria_terminalis_on_FA_skeleton_(left)	Mean FA in fornix cres+stria terminalis on FA skeleton (L)	58
INI	INI25096	1063	Mean_FA_in_superior_longitudinal_fasciculus_on_FA_skeleton_(right)	Mean FA in superior longitudinal fasciculus on FA skeleton (R)	62
INI	INI25097	1063	Mean_FA_in_superior_longitudinal_fasciculus_on_FA_skeleton_(left)	Mean FA in superior longitudinal fasciculus on FA skeleton (L)	62
INI	INI25098	1063	Mean_FA_in_superior_fronto-occipital_fasciculus_on_FA_skeleton_(right)	Mean FA in superior fronto-occipital fasciculus on FA skeleton (R)	66
INI	INI25099	1063	Mean_FA_in_superior_fronto-occipital_fasciculus_on_FA_skeleton_(left)	Mean FA in superior fronto-occipital fasciculus on FA skeleton (L)	66
INI	INI25100	1063	Mean_FA_in_uncinate_fasciculus_on_FA_skeleton_(right)	Mean FA in uncinate fasciculus on FA skeleton (R)	49
INI	INI25101	1063	Mean_FA_in_uncinate_fasciculus_on_FA_skeleton_(left)	Mean FA in uncinate fasciculus on FA skeleton (L)	49
INI	INI25102	1063	Mean_FA_in_tapetum_on_FA_skeleton_(right)	Mean FA in tapetum on FA skeleton (R)	37
INI	INI25103	1063	Mean_FA_in_tapetum_on_FA_skeleton_(left)	Mean FA in tapetum on FA skeleton (L)	37
INI	INI25344	1062	Mean_ICVF_in_middle_cerebellar_peduncle_on_FA_skeleton	Mean ICVF in middle cerebellar peduncle on FA skeleton	54
INI	INI25345	1062	Mean_ICVF_in_pontine_crossing_tract_on_FA_skeleton	Mean ICVF in pontine crossing tract on FA skeleton	50
INI	INI25346	1062	Mean_ICVF_in_genu_of_corpus_callosum_on_FA_skeleton	Mean ICVF in genu of corpus callosum on FA skeleton	51
INI	INI25347	1062	Mean_ICVF_in_body_of_corpus_callosum_on_FA_skeleton	Mean ICVF in body of corpus callosum on FA skeleton	51
INI	INI25348	1062	Mean_ICVF_in_splenium_of_corpus_callosum_on_FA_skeleton	Mean ICVF in splenium of corpus callosum on FA skeleton	55
INI	INI25349	1062	Mean_ICVF_in_fornix_on_FA_skeleton	Mean ICVF in fornix on FA skeleton	34
INI	INI25350	1062	Mean_ICVF_in_corticospinal_tract_on_FA_skeleton_(right)	Mean ICVF in corticospinal tract on FA skeleton (R)	51
INI	INI25351	1062	Mean_ICVF_in_corticospinal_tract_on_FA_skeleton_(left)	Mean ICVF in corticospinal tract on FA skeleton (L)	51
INI	INI25352	1062	Mean_ICVF_in_medial_lemniscus_on_FA_skeleton_(right)	Mean ICVF in medial lemniscus on FA skeleton (R)	48
INI	INI25353	1062	Mean_ICVF_in_medial_lemniscus_on_FA_skeleton_(left)	Mean ICVF in medial lemniscus on FA skeleton (L)	48
INI	INI25354	1062	Mean_ICVF_in_inferior_cerebellar_peduncle_on_FA_skeleton_(right)	Mean ICVF in inferior cerebellar peduncle on FA skeleton (R)	60
INI	INI25355	1062	Mean_ICVF_in_inferior_cerebellar_peduncle_on_FA_skeleton_(left)	Mean ICVF in inferior cerebellar peduncle on FA skeleton (L)	60
INI	INI25356	1062	Mean_ICVF_in_superior_cerebellar_peduncle_on_FA_skeleton_(right)	Mean ICVF in superior cerebellar peduncle on FA skeleton (R)	60
INI	INI25357	1062	Mean_ICVF_in_superior_cerebellar_peduncle_on_FA_skeleton_(left)	Mean ICVF in superior cerebellar peduncle on FA skeleton (L)	60
INI	INI25358	1062	Mean_ICVF_in_cerebral_peduncle_on_FA_skeleton_(right)	Mean ICVF in cerebral peduncle on FA skeleton (R)	49
INI	INI25359	1062	Mean_ICVF_in_cerebral_peduncle_on_FA_skeleton_(left)	Mean ICVF in cerebral peduncle on FA skeleton (L)	49
INI	INI25360	1062	Mean_ICVF_in_anterior_limb_of_internal_capsule_on_FA_skeleton_(right)	Mean ICVF in anterior limb of internal capsule on FA skeleton (R)	65
INI	INI25361	1062	Mean_ICVF_in_anterior_limb_of_internal_capsule_on_FA_skeleton_(left)	Mean ICVF in anterior limb of internal capsule on FA skeleton (L)	65
INI	INI25362	1062	Mean_ICVF_in_posterior_limb_of_internal_capsule_on_FA_skeleton_(right)	Mean ICVF in posterior limb of internal capsule on FA skeleton (R)	66
INI	INI25363	1062	Mean_ICVF_in_posterior_limb_of_internal_capsule_on_FA_skeleton_(left)	Mean ICVF in posterior limb of internal capsule on FA skeleton (L)	66
INI	INI25364	1062	Mean_ICVF_in_retrolenticular_part_of_internal_capsule_on_FA_skeleton_(right)	Mean ICVF in retrolenticular part of internal capsule on FA skeleton (R)	72
INI	INI25365	1062	Mean_ICVF_in_retrolenticular_part_of_internal_capsule_on_FA_skeleton_(left)	Mean ICVF in retrolenticular part of internal capsule on FA skeleton (L)	72
INI	INI25366	1062	Mean_ICVF_in_anterior_corona_radiata_on_FA_skeleton_(right)	Mean ICVF in anterior corona radiata on FA skeleton (R)	55
INI	INI25367	1062	Mean_ICVF_in_anterior_corona_radiata_on_FA_skeleton_(left)	Mean ICVF in anterior corona radiata on FA skeleton (L)	55
INI	INI25368	1062	Mean_ICVF_in_superior_corona_radiata_on_FA_skeleton_(right)	Mean ICVF in superior corona radiata on FA skeleton (R)	55
INI	INI25369	1062	Mean_ICVF_in_superior_corona_radiata_on_FA_skeleton_(left)	Mean ICVF in superior corona radiata on FA skeleton (L)	55
INI	INI25370	1062	Mean_ICVF_in_posterior_corona_radiata_on_FA_skeleton_(right)	Mean ICVF in posterior corona radiata on FA skeleton (R)	56
INI	INI25371	1062	Mean_ICVF_in_posterior_corona_radiata_on_FA_skeleton_(left)	Mean ICVF in posterior corona radiata on FA skeleton (L)	56
INI	INI25372	1062	Mean_ICVF_in_posterior_thalamic_radiation_on_FA_skeleton_(right)	Mean ICVF in posterior thalamic radiation on FA skeleton (R)	60
INI	INI25373	1062	Mean_ICVF_in_posterior_thalamic_radiation_on_FA_skeleton_(left)	Mean ICVF in posterior thalamic radiation on FA skeleton (L)	60
INI	INI25374	1062	Mean_ICVF_in_sagittal_stratum_on_FA_skeleton_(right)	Mean ICVF in sagittal stratum on FA skeleton (R)	48
INI	INI25375	1062	Mean_ICVF_in_sagittal_stratum_on_FA_skeleton_(left)	Mean ICVF in sagittal stratum on FA skeleton (L)	48
INI	INI25376	1062	Mean_ICVF_in_external_capsule_on_FA_skeleton_(right)	Mean ICVF in external capsule on FA skeleton (R)	48
INI	INI25377	1062	Mean_ICVF_in_external_capsule_on_FA_skeleton_(left)	Mean ICVF in external capsule on FA skeleton (L)	48
INI	INI25378	1062	Mean_ICVF_in_cingulum_cingulate_gyrus_on_FA_skeleton_(right)	Mean ICVF in cingulum cingulate gyrus on FA skeleton (R)	56
INI	INI25379	1062	Mean_ICVF_in_cingulum_cingulate_gyrus_on_FA_skeleton_(left)	Mean ICVF in cingulum cingulate gyrus on FA skeleton (L)	56
INI	INI25380	1062	Mean_ICVF_in_cingulum_hippocampus_on_FA_skeleton_(right)	Mean ICVF in cingulum hippocampus on FA skeleton (R)	52
INI	INI25381	1062	Mean_ICVF_in_cingulum_hippocampus_on_FA_skeleton_(left)	Mean ICVF in cingulum hippocampus on FA skeleton (L)	52
INI	INI25382	1062	Mean_ICVF_in_fornix_cres+stria_terminalis_on_FA_skeleton_(right)	Mean ICVF in fornix cres+stria terminalis on FA skeleton (R)	60
INI	INI25383	1062	Mean_ICVF_in_fornix_cres+stria_terminalis_on_FA_skeleton_(left)	Mean ICVF in fornix cres+stria terminalis on FA skeleton (L)	60
INI	INI25384	1062	Mean_ICVF_in_superior_longitudinal_fasciculus_on_FA_skeleton_(right)	Mean ICVF in superior longitudinal fasciculus on FA skeleton (R)	64
INI	INI25385	1062	Mean_ICVF_in_superior_longitudinal_fasciculus_on_FA_skeleton_(left)	Mean ICVF in superior longitudinal fasciculus on FA skeleton (L)	64
INI	INI25386	1062	Mean_ICVF_in_superior_fronto-occipital_fasciculus_on_FA_skeleton_(right)	Mean ICVF in superior fronto-occipital fasciculus on FA skeleton (R)	68
INI	INI25387	1062	Mean_ICVF_in_superior_fronto-occipital_fasciculus_on_FA_skeleton_(left)	Mean ICVF in superior fronto-occipital fasciculus on FA skeleton (L)	68
INI	INI25388	1062	Mean_ICVF_in_uncinate_fasciculus_on_FA_skeleton_(right)	Mean ICVF in uncinate fasciculus on FA skeleton (R)	51
INI	INI25389	1062	Mean_ICVF_in_uncinate_fasciculus_on_FA_skeleton_(left)	Mean ICVF in uncinate fasciculus on FA skeleton (L)	51
INI	INI25390	1062	Mean_ICVF_in_tapetum_on_FA_skeleton_(right)	Mean ICVF in tapetum on FA skeleton (R)	39
INI	INI25391	1062	Mean_ICVF_in_tapetum_on_FA_skeleton_(left)	Mean ICVF in tapetum on FA skeleton (L)	39
INI	INI25440	1062	Mean_ISOVF_in_middle_cerebellar_peduncle_on_FA_skeleton	Mean ISOVF in middle cerebellar peduncle on FA skeleton	55
INI	INI25441	1062	Mean_ISOVF_in_pontine_crossing_tract_on_FA_skeleton	Mean ISOVF in pontine crossing tract on FA skeleton	51
INI	INI25442	1062	Mean_ISOVF_in_genu_of_corpus_callosum_on_FA_skeleton	Mean ISOVF in genu of corpus callosum on FA skeleton	52
INI	INI25443	1062	Mean_ISOVF_in_body_of_corpus_callosum_on_FA_skeleton	Mean ISOVF in body of corpus callosum on FA skeleton	52
INI	INI25444	1062	Mean_ISOVF_in_splenium_of_corpus_callosum_on_FA_skeleton	Mean ISOVF in splenium of corpus callosum on FA skeleton	56
INI	INI25445	1062	Mean_ISOVF_in_fornix_on_FA_skeleton	Mean ISOVF in fornix on FA skeleton	35
INI	INI25446	1062	Mean_ISOVF_in_corticospinal_tract_on_FA_skeleton_(right)	Mean ISOVF in corticospinal tract on FA skeleton (R)	52
INI	INI25447	1062	Mean_ISOVF_in_corticospinal_tract_on_FA_skeleton_(left)	Mean ISOVF in corticospinal tract on FA skeleton (L)	52
INI	INI25448	1062	Mean_ISOVF_in_medial_lemniscus_on_FA_skeleton_(right)	Mean ISOVF in medial lemniscus on FA skeleton (R)	49
INI	INI25449	1062	Mean_ISOVF_in_medial_lemniscus_on_FA_skeleton_(left)	Mean ISOVF in medial lemniscus on FA skeleton (L)	49
INI	INI25450	1062	Mean_ISOVF_in_inferior_cerebellar_peduncle_on_FA_skeleton_(right)	Mean ISOVF in inferior cerebellar peduncle on FA skeleton (R)	61
INI	INI25451	1062	Mean_ISOVF_in_inferior_cerebellar_peduncle_on_FA_skeleton_(left)	Mean ISOVF in inferior cerebellar peduncle on FA skeleton (L)	61
INI	INI25452	1062	Mean_ISOVF_in_superior_cerebellar_peduncle_on_FA_skeleton_(right)	Mean ISOVF in superior cerebellar peduncle on FA skeleton (R)	61
INI	INI25453	1062	Mean_ISOVF_in_superior_cerebellar_peduncle_on_FA_skeleton_(left)	Mean ISOVF in superior cerebellar peduncle on FA skeleton (L)	61
INI	INI25454	1062	Mean_ISOVF_in_cerebral_peduncle_on_FA_skeleton_(right)	Mean ISOVF in cerebral peduncle on FA skeleton (R)	50
INI	INI25455	1062	Mean_ISOVF_in_cerebral_peduncle_on_FA_skeleton_(left)	Mean ISOVF in cerebral peduncle on FA skeleton (L)	50
INI	INI25456	1062	Mean_ISOVF_in_anterior_limb_of_internal_capsule_on_FA_skeleton_(right)	Mean ISOVF in anterior limb of internal capsule on FA skeleton (R)	66
INI	INI25457	1062	Mean_ISOVF_in_anterior_limb_of_internal_capsule_on_FA_skeleton_(left)	Mean ISOVF in anterior limb of internal capsule on FA skeleton (L)	66
INI	INI25458	1062	Mean_ISOVF_in_posterior_limb_of_internal_capsule_on_FA_skeleton_(right)	Mean ISOVF in posterior limb of internal capsule on FA skeleton (R)	67
INI	INI25459	1062	Mean_ISOVF_in_posterior_limb_of_internal_capsule_on_FA_skeleton_(left)	Mean ISOVF in posterior limb of internal capsule on FA skeleton (L)	67
INI	INI25460	1062	Mean_ISOVF_in_retrolenticular_part_of_internal_capsule_on_FA_skeleton_(right)	Mean ISOVF in retrolenticular part of internal capsule on FA skeleton (R)	73
INI	INI25461	1062	Mean_ISOVF_in_retrolenticular_part_of_internal_capsule_on_FA_skeleton_(left)	Mean ISOVF in retrolenticular part of internal capsule on FA skeleton (L)	73
INI	INI25462	1062	Mean_ISOVF_in_anterior_corona_radiata_on_FA_skeleton_(right)	Mean ISOVF in anterior corona radiata on FA skeleton (R)	56
INI	INI25463	1062	Mean_ISOVF_in_anterior_corona_radiata_on_FA_skeleton_(left)	Mean ISOVF in anterior corona radiata on FA skeleton (L)	56
INI	INI25464	1062	Mean_ISOVF_in_superior_corona_radiata_on_FA_skeleton_(right)	Mean ISOVF in superior corona radiata on FA skeleton (R)	56
INI	INI25465	1062	Mean_ISOVF_in_superior_corona_radiata_on_FA_skeleton_(left)	Mean ISOVF in superior corona radiata on FA skeleton (L)	56
INI	INI25466	1062	Mean_ISOVF_in_posterior_corona_radiata_on_FA_skeleton_(right)	Mean ISOVF in posterior corona radiata on FA skeleton (R)	57
INI	INI25467	1062	Mean_ISOVF_in_posterior_corona_radiata_on_FA_skeleton_(left)	Mean ISOVF in posterior corona radiata on FA skeleton (L)	57
INI	INI25468	1062	Mean_ISOVF_in_posterior_thalamic_radiation_on_FA_skeleton_(right)	Mean ISOVF in posterior thalamic radiation on FA skeleton (R)	61
INI	INI25469	1062	Mean_ISOVF_in_posterior_thalamic_radiation_on_FA_skeleton_(left)	Mean ISOVF in posterior thalamic radiation on FA skeleton (L)	61
INI	INI25470	1062	Mean_ISOVF_in_sagittal_stratum_on_FA_skeleton_(right)	Mean ISOVF in sagittal stratum on FA skeleton (R)	49
INI	INI25471	1062	Mean_ISOVF_in_sagittal_stratum_on_FA_skeleton_(left)	Mean ISOVF in sagittal stratum on FA skeleton (L)	49
INI	INI25472	1062	Mean_ISOVF_in_external_capsule_on_FA_skeleton_(right)	Mean ISOVF in external capsule on FA skeleton (R)	49
INI	INI25473	1062	Mean_ISOVF_in_external_capsule_on_FA_skeleton_(left)	Mean ISOVF in external capsule on FA skeleton (L)	49
INI	INI25474	1062	Mean_ISOVF_in_cingulum_cingulate_gyrus_on_FA_skeleton_(right)	Mean ISOVF in cingulum cingulate gyrus on FA skeleton (R)	57
INI	INI25475	1062	Mean_ISOVF_in_cingulum_cingulate_gyrus_on_FA_skeleton_(left)	Mean ISOVF in cingulum cingulate gyrus on FA skeleton (L)	57
INI	INI25476	1062	Mean_ISOVF_in_cingulum_hippocampus_on_FA_skeleton_(right)	Mean ISOVF in cingulum hippocampus on FA skeleton (R)	53
INI	INI25477	1062	Mean_ISOVF_in_cingulum_hippocampus_on_FA_skeleton_(left)	Mean ISOVF in cingulum hippocampus on FA skeleton (L)	53
INI	INI25478	1062	Mean_ISOVF_in_fornix_cres+stria_terminalis_on_FA_skeleton_(right)	Mean ISOVF in fornix cres+stria terminalis on FA skeleton (R)	61
INI	INI25479	1062	Mean_ISOVF_in_fornix_cres+stria_terminalis_on_FA_skeleton_(left)	Mean ISOVF in fornix cres+stria terminalis on FA skeleton (L)	61
INI	INI25482	1062	Mean_ISOVF_in_superior_fronto-occipital_fasciculus_on_FA_skeleton_(right)	Mean ISOVF in superior fronto-occipital fasciculus on FA skeleton (R)	69
INI	INI25483	1062	Mean_ISOVF_in_superior_fronto-occipital_fasciculus_on_FA_skeleton_(left)	Mean ISOVF in superior fronto-occipital fasciculus on FA skeleton (L)	69
INI	INI25488	1062	Weighted-mean_FA_in_tract_acoustic_radiation_(left)	WA FA in tract acoustic radiation (L)	37
INI	INI25489	1062	Weighted-mean_FA_in_tract_acoustic_radiation_(right)	WA FA in tract acoustic radiation (R)	37
