GBE_category	GBE_ID	N	GBE_NAME	GBE_short_name	GBE_short_name_len
BIN	BIN100020	4951	Typical_diet_yesterday	Typical diet yesterday	22
BIN	BIN100240	4070	Coffee_consumed	Coffee consumed	15
BIN	BIN100260	2221	Added_milk_to_instant_coffee_always_(Diet,_24hr_recall,_Online_follow-up)	Added milk to instant coffee always (Diet, 24hr recall, Online follow-up)	73
BIN	BIN100280	1099	Added_milk_to_filtered_coffee_always_(Diet,_24hr_recall,_Online_follow-up)	Added milk to filtered coffee always (Diet, 24hr recall, Online follow-up)	74
BIN	BIN10030500	987	Microalbumin_higher_than_40_mg/L	Microalbumin > 40 mg/L	22
BIN	BIN10030800	1824	Oestradiol_higher_than_212_pmol/L	Oestradiol > 212 pmol/L	23
BIN	BIN10030820	551	Rheumatoid_factor_higher_than_16_IU/mL	Rheumatoid factor > 16 IU/mL	28
BIN	BIN100320	72	Added_milk_to_espresso_always_(Diet,_24hr_recall,_Online_follow-up)	Added milk to espresso always (Diet, 24hr recall, Online follow-up)	67
BIN	BIN100350	74	Added_milk_to_other_coffee_type_always_(Diet,_24hr_recall,_Online_follow-up)	Added milk to other coffee type always (Diet, 24hr recall, Online follow-up)	76
BIN	BIN100360	656	Decaffeinated_coffee_always_(Diet,_24hr_recall,_Online_follow-up)	Decaffeinated coffee always (Diet, 24hr recall, Online follow-up)	65
BIN	BIN100390	4524	Tea_consumed	Tea consumed	12
BIN	BIN100460	3420	Added_milk_to_standard_tea_always_(Diet,_24hr_recall,_Online_follow-up)	Added milk to standard tea always (Diet, 24hr recall, Online follow-up)	71
BIN	BIN100470	339	Decaffeinated_tea_always_(Diet,_24hr_recall,_Online_follow-up)	Decaffeinated tea always (Diet, 24hr recall, Online follow-up)	62
BIN	BIN100480	158	Added_milk_to_rooibos_tea_always_(Diet,_24hr_recall,_Online_follow-up)	Added milk to rooibos tea always (Diet, 24hr recall, Online follow-up)	70
BIN	BIN100510	1163	Other_non-alcoholic_drinks	Other non-alcoholic drinks	26
BIN	BIN100580	3149	Alcohol_consumed	Alcohol consumed	16
BIN	BIN100760	3704	Breakfast_cereal_consumed	Breakfast cereal consumed	25
BIN	BIN100880	1952	Dried_fruit_added_to_cereal_always_(Diet,_24hr_recall,_Online_follow-up)	Dried fruit added to cereal always (Diet, 24hr recall, Online follow-up)	72
BIN	BIN100890	3182	Milk_added_to_cereal_always_(Diet,_24hr_recall,_Online_follow-up)	Milk added to cereal always (Diet, 24hr recall, Online follow-up)	65
BIN	BIN100940	4999	Bread_consumed	Bread consumed	14
BIN	BIN101300	3968	Butter/margarine_on_bread/crackers	Butter/margarine on bread/crackers	34
BIN	BIN1020483	110	Ever_attempted_suicide_missing_is_control	Ever attempted suicide missing is control	41
BIN	BIN102080	2939	Yogurt/ice-cream_consumers	Yogurt/ice-cream consumers	26
BIN	BIN102130	2615	Dessert_consumers	Dessert consumers	17
BIN	BIN102250	3755	Sweet_snack_consumers	Sweet snack consumers	21
BIN	BIN102400	2994	Savoury_snack_consumers	Savoury snack consumers	23
BIN	BIN102520	1632	Soup_consumers	Soup consumers	14
BIN	BIN102700	2886	Starchy_food_consumers	Starchy food consumers	22
BIN	BIN102800	3323	Cheese_consumers	Cheese consumers	16
BIN	BIN102930	2068	Egg_consumers	Egg consumers	13
BIN	BIN103000	4337	Meat_consumers	Meat consumers	14
BIN	BIN103120	1897	Fat_removed_from_meat_always_(Diet,_24hr_recall,_Online_follow-up)	Fat removed from meat always (Diet, 24hr recall, Online follow-up)	66
BIN	BIN103130	1915	Skin_removed_from_poultry_always_(Diet,_24hr_recall,_Online_follow-up)	Skin removed from poultry always (Diet, 24hr recall, Online follow-up)	70
BIN	BIN103140	2624	Fish_consumer	Fish consumer	13
BIN	BIN103990	4969	Vegetable_consumers	Vegetable consumers	19
BIN	BIN104040	377	Butter/margarine_added_to_potatoes	Butter/margarine added to potatoes	34
BIN	BIN104400	4802	Fruit_consumers	Fruit consumers	15
BIN	BIN104670	2658	Vitamin_supplement_user	Vitamin supplement user	23
BIN	BIN1210	4146	Snoring	Snoring	7
BIN	BIN12139	21	Believed_safe_to_perform_brain_MRI_scan	Believed safe to perform brain MRI scan	39
BIN	BIN12188	1104	Brain_MRI_measurement_completed	Brain MRI measurement completed	31
BIN	BIN1518	11678	Drinks_hot_drinks_or_not	Drinks hot drinks or not	24
BIN	BIN1618	4422	Alcohol_usually_taken_with_meals	Alcohol usually taken with meals	32
BIN	BIN1677	6990	Breastfed_as_a_baby	Breastfed as a baby	19
BIN	BIN19	5392	Heel_ultrasound_method	Heel ultrasound method	22
BIN	BIN1920	5514	Mood_swings	Mood swings	11
BIN	BIN1930	5023	Miserableness	Miserableness	13
BIN	BIN1940	3445	Irritability	Irritability	12
BIN	BIN1950	6462	Sensitivity_/_hurt_feelings	Sensitivity / hurt feelings	27
BIN	BIN1960	4830	Fed-up_feelings	Fed-up feelings	15
BIN	BIN1970	2665	Nervous_feelings	Nervous feelings	16
BIN	BIN1980	6533	Worrier_/_anxious_feelings	Worrier / anxious feelings	26
BIN	BIN1990	2396	Tense_/_'highly_strung'	Tense / 'highly strung'	23
BIN	BIN2000	5478	Worry_too_long_after_embarrassment	Worry too long after embarrassment	34
BIN	BIN2010	2371	Suffer_from_'nerves'	Suffer from 'nerves'	20
BIN	BIN20123	272	Single_episode_of_probable_major_depression	Single episode of probable major depression	43
BIN	BIN20124	438	Probable_recurrent_major_depression_(moderate)	Probable recurrent major depression (moderate)	46
BIN	BIN20125	338	Probable_recurrent_major_depression_(severe)	Probable recurrent major depression (severe)	44
BIN	BIN2020	2575	Loneliness,_isolation	Loneliness, isolation	21
BIN	BIN2030	3666	Guilty_feelings	Guilty feelings	15
BIN	BIN2040	3914	Risk_taking	Risk taking	11
BIN	BIN20401	252	Ever_addicted_to_any_substance_or_behaviour	Ever addicted to any substance or behaviour	43
BIN	BIN20404	23	Ever_physically_dependent_on_alcohol	Ever physically dependent on alcohol	36
BIN	BIN20406	80	Ever_addicted_to_alcohol	Ever addicted to alcohol	24
BIN	BIN20415	26	Ongoing_addiction_to_alcohol	Ongoing addiction to alcohol	28
BIN	BIN20417	466	Tense,_sore,_or_aching_muscles_during_worst_period_of_anxiety	Tense, sore, or aching muscles during worst period of anxiety	61
BIN	BIN20419	889	Difficulty_concentrating_during_worst_period_of_anxiety	Difficulty concentrating during worst period of anxiety	55
BIN	BIN20421	984	Ever_felt_worried,_tense,_or_anxious_for_most_of_a_month_or_longer	Ever felt worried, tense, or anxious for most of a month or longer	66
BIN	BIN20422	787	More_irritable_than_usual_during_worst_period_of_anxiety	More irritable than usual during worst period of anxiety	56
BIN	BIN20423	901	Keyed_up_or_on_edge_during_worst_period_of_anxiety	Keyed up or on edge during worst period of anxiety	50
BIN	BIN20425	908	Ever_worried_more_than_most_people_would_in_similar_situation	Ever worried more than most people would in similar situation	61
BIN	BIN20426	678	Restless_during_period_of_worst_anxiety	Restless during period of worst anxiety	39
BIN	BIN20427	960	Frequent_trouble_falling_or_staying_asleep_during_worst_period_of_anxiety	Frequent trouble falling or staying asleep during worst period of anxiety	73
BIN	BIN20428	747	Professional_informed_about_anxiety	Professional informed about anxiety	35
BIN	BIN20429	828	Easily_tired_during_worst_period_of_anxiety	Easily tired during worst period of anxiety	43
BIN	BIN20431	78	Ever_addicted_to_a_behaviour_or_miscellanous	Ever addicted to a behaviour or miscellanous	44
BIN	BIN20432	40	Ongoing_behavioural_or_miscellanous_addiction	Ongoing behavioural or miscellanous addiction	45
BIN	BIN20435	1531	Difficulty_concentrating_during_worst_depression	Difficulty concentrating during worst depression	48
BIN	BIN20437	1051	Thoughts_of_death_during_worst_depression	Thoughts of death during worst depression	41
BIN	BIN20441	1564	Ever_had_prolonged_loss_of_interest_in_normal_activities	Ever had prolonged loss of interest in normal activities	56
BIN	BIN20445	144	Depression_possibly_related_to_childbirth	Depression possibly related to childbirth	41
BIN	BIN20446	2141	Ever_had_prolonged_feelings_of_sadness_or_depression	Ever had prolonged feelings of sadness or depression	52
BIN	BIN20447	1592	Depression_possibly_related_to_stressful_or_traumatic_event	Depression possibly related to stressful or traumatic event	59
BIN	BIN20448	1420	Professional_informed_about_depression	Professional informed about depression	38
BIN	BIN20449	1605	Feelings_of_tiredness_during_worst_episode_of_depression	Feelings of tiredness during worst episode of depression	56
BIN	BIN20450	1126	Feelings_of_worthlessness_during_worst_period_of_depression	Feelings of worthlessness during worst period of depression	59
BIN	BIN20456	42	Ever_addicted_to_illicit_or_recreational_drugs	Ever addicted to illicit or recreational drugs	46
BIN	BIN20457	12	Ongoing_addiction_or_dependence_on_illicit_or_recreational_drugs	Ongoing addiction or dependence on illicit or recreational drugs	64
BIN	BIN20463	92	Ever_heard_an_un-real_voice	Ever heard an un-real voice	27
BIN	BIN20466	26	Ever_prescribed_a_medication_for_unusual_or_psychotic_experiences	Ever prescribed a medication for unusual or psychotic experiences	65
BIN	BIN20468	34	Ever_believed_in_an_un-real_conspiracy_against_self	Ever believed in an un-real conspiracy against self	51
BIN	BIN20471	156	Ever_seen_an_un-real_vision	Ever seen an un-real vision	27
BIN	BIN20474	42	Ever_believed_in_un-real_communications_or_signs	Ever believed in un-real communications or signs	48
BIN	BIN20477	48	Ever_talked_to_a_health_professional_about_unusual_or_psychotic_experiences	Ever talked to a health professional about unusual or psychotic experiences	75
BIN	BIN20480	213	Ever_self-harmed	Ever self-harmed	16
BIN	BIN20481	19	Self-harmed_in_past_year	Self-harmed in past year	24
BIN	BIN20483	110	Ever_attempted_suicide	Ever attempted suicide	22
BIN	BIN20484	3	Attempted_suicide_in_past_year	Attempted suicide in past year	30
BIN	BIN20486	114	Contemplated_self-harm_in_past_year	Contemplated self-harm in past year	35
BIN	BIN20496	559	Mania_needed_treatment_or_caused_problems_with_work,_relationships,_finances,_the_law,_or_other_aspects_of_life	Mania needed treatment or caused problems with work, relationships, finances, the law, or other aspects of life	111
BIN	BIN20499	1604	Ever_sought_or_received_professional_help_for_mental_distress	Ever sought or received professional help for mental distress	61
BIN	BIN20500	1340	Ever_suffered_mental_distress_preventing_usual_activities	Ever suffered mental distress preventing usual activities	57
BIN	BIN20501	207	Ever_had_period_of_mania_/_excitability	Ever had period of mania / excitability	39
BIN	BIN20502	1073	Ever_had_period_extreme_irritability	Ever had period extreme irritability	36
BIN	BIN20503	40	Ever_addicted_to_prescription_or_over-the-counter_medication	Ever addicted to prescription or over-the-counter medication	60
BIN	BIN20504	12	Ongoing_addiction_or_dependence_to_over-the-counter_medication	Ongoing addiction or dependence to over-the-counter medication	62
BIN	BIN20532	1464	Did_your_sleep_change?	Did your sleep change?	22
BIN	BIN20533	1141	Trouble_falling_asleep	Trouble falling asleep	22
BIN	BIN20534	345	Sleeping_too_much	Sleeping too much	17
BIN	BIN20535	1099	Waking_too_early	Waking too early	16
BIN	BIN20538	1050	Worried_most_days_during_period_of_worst_anxiety	Worried most days during period of worst anxiety	48
BIN	BIN20540	929	Multiple_worries_during_worst_period_of_anxiety	Multiple worries during worst period of anxiety	47
BIN	BIN20541	1136	Difficulty_stopping_worrying_during_worst_period_of_anxiety	Difficulty stopping worrying during worst period of anxiety	59
BIN	BIN20542	713	Stronger_worrying_(than_other_people)_during_period_of_worst_anxiety	Stronger worrying (than other people) during period of worst anxiety	68
BIN	BIN2090	4090	Seen_doctor_(GP)_for_nerves,_anxiety,_tension_or_depression	Seen doctor (GP) for nerves, anxiety, tension or depression	59
BIN	BIN2100	1672	Seen_a_psychiatrist_for_nerves,_anxiety,_tension_or_depression	Seen a psychiatrist for nerves, anxiety, tension or depression	62
BIN	BIN21024	523	Ever_diagnosed_with_IBS	Ever diagnosed with IBS	23
BIN	BIN21026	41	Discomfort/pain_occurring_only_during_menstrual_bleed	Discomfort/pain occurring only during menstrual bleed	53
BIN	BIN21027	1231	Abdominal_discomfort/pain_for_6_months_or_longer	Abdominal discomfort/pain for 6 months or longer	48
BIN	BIN21035	1297	Currently_(in_last_3_months)_suffer_from_abdominal_pain	Currently (in last 3 months) suffer from abdominal pain	55
BIN	BIN21038	1040	Currently_suffer_from_abdominal_distension	Currently suffer from abdominal distension	42
BIN	BIN21062	947	Ever_been_offered/sought_treatment_for_anxiety	Ever been offered/sought treatment for anxiety	46
BIN	BIN21063	1044	Ever_been_offered/sought_treatment_for_depression	Ever been offered/sought treatment for depression	49
BIN	BIN21064	980	Sensitive_stomach	Sensitive stomach	17
BIN	BIN21065	630	Family_history_of_IBS	Family history of IBS	21
BIN	BIN21066	135	Born_by_caesarian_section	Born by caesarian section	25
BIN	BIN21067	620	Long-term/recurrent_antibiotics_as_child_or_teenager	Long-term/recurrent antibiotics as child or teenager	52
BIN	BIN21068	73	Diagnosed_with_coeliac_disease_or_gluten_sensitivity	Diagnosed with coeliac disease or gluten sensitivity	52
BIN	BIN21070	129	Speed_of_onset_of_IBS_symptoms	Speed of onset of IBS symptoms	30
BIN	BIN21071	59	Infectious_illness_diagnosis_status_when_IBS_symptoms_first_began	Infectious illness diagnosis status when IBS symptoms first began	65
BIN	BIN21073	36	Fever_when_IBS_symptoms_first_began	Fever when IBS symptoms first began	35
BIN	BIN21074	272	Diarrhoea_when_IBS_symptoms_first_began	Diarrhoea when IBS symptoms first began	39
BIN	BIN21075	30	Bloody_diarrhoea_when_IBS_symptoms_first_began	Bloody diarrhoea when IBS symptoms first began	46
BIN	BIN21076	43	Vomiting_when_IBS_symptoms_first_began	Vomiting when IBS symptoms first began	38
BIN	BIN2188	3883	Long-standing_illness,_disability_or_infirmity	Long-standing illness, disability or infirmity	46
BIN	BIN2207	10149	Wears_glasses_or_contact_lenses	Wears glasses or contact lenses	31
BIN	BIN22126	753	Doctor_diagnosed_hayfever_or_allergic_rhinitis	Doctor diagnosed hayfever or allergic rhinitis	46
BIN	BIN22127	374	Doctor_diagnosed_asthma	Doctor diagnosed asthma	23
BIN	BIN22128	5	Doctor_diagnosed_emphysema	Doctor diagnosed emphysema	26
BIN	BIN22129	33	Doctor_diagnosed_chronic_bronchitis	Doctor diagnosed chronic bronchitis	35
BIN	BIN22130	40	Doctor_diagnosed_COPD_(chronic_obstructive_pulmonary_disease)	Doctor diagnosed COPD	21
BIN	BIN22131	0	Doctor_diagnosed_cystic_fibrosis	Doctor diagnosed cystic fibrosis	32
BIN	BIN22132	1	Doctor_diagnosed_alpha-1_antitrypsin_deficiency	Doctor diagnosed alpha-1 antitrypsin deficiency	47
BIN	BIN22133	14	Doctor_diagnosed_sarcoidosis	Doctor diagnosed sarcoidosis	28
BIN	BIN22134	19	Doctor_diagnosed_bronchiectasis	Doctor diagnosed bronchiectasis	31
BIN	BIN22135	2	Doctor_diagnosed_idiopathic_pulmonary_fibrosis	Doctor diagnosed idiopathic pulmonary fibrosis	46
BIN	BIN22136	1	Doctor_diagnosed_fibrosing_alveolitis/unspecified_alveolitis	Doctor diagnosed fibrosing alveolitis/unspecified alveolitis	60
BIN	BIN22137	12	Doctor_diagnosed_tuberculosis	Doctor diagnosed tuberculosis	29
BIN	BIN22138	0	Doctor_diagnosed_silicosis	Doctor diagnosed silicosis	26
BIN	BIN22139	2	Doctor_diagnosed_asbestosis	Doctor diagnosed asbestosis	27
BIN	BIN22140	5	Doctor_diagnosed_lung_cancer_(not_mesothelioma)	Doctor diagnosed lung cancer (not mesothelioma)	47
BIN	BIN22141	1	Doctor_diagnosed_mesothelioma_of_the_lung	Doctor diagnosed mesothelioma of the lung	41
BIN	BIN22502	358	Cough_on_most_days	Cough on most days	18
BIN	BIN22504	225	Bring_up_phlegm/sputum/mucus_on_most_days	Bring up phlegm/sputum/mucus on most days	41
BIN	BIN2257	4300	Hearing_difficulty/problems_with_background_noise	Hearing problems with background noise	38
BIN	BIN23050	164	HSV-1_seropositivity_for_Herpes_Simplex_virus-1	HSV-1 seropositivity for Herpes Simplex virus-1	47
BIN	BIN23051	39	HSV-2_seropositivity_for_Herpes_Simplex_virus-2	HSV-2 seropositivity for Herpes Simplex virus-2	47
BIN	BIN23052	210	VZV_seropositivity_for_Varicella_Zoster_Virus	VZV seropositivity for Varicella Zoster Virus	45
BIN	BIN23053	220	EBV_seropositivity_for_Epstein-Barr_Virus	EBV seropositivity for Epstein-Barr Virus	41
BIN	BIN23054	138	CMV_seropositivity_for_Human_Cytomegalovirus	CMV seropositivity for Human Cytomegalovirus	44
BIN	BIN23055	208	HHV-6_overall_seropositivity_for_Human_Herpesvirus-6	HHV-6 overall seropositivity for Human Herpesvirus-6	52
BIN	BIN23056	182	HHV-6A_seropositivity_for_Human_Herpesvirus-6	HHV-6A seropositivity for Human Herpesvirus-6	45
BIN	BIN23057	175	HHV-6B_seropositivity_for_Human_Herpesvirus-6	HHV-6B seropositivity for Human Herpesvirus-6	45
BIN	BIN23058	218	HHV-7_seropositivity_for_Human_Herpesvirus-7	HHV-7 seropositivity for Human Herpesvirus-7	44
BIN	BIN23059	17	KSHV_seropositivity_for_Kaposi's_Sarcoma-Associated_Herpesvirus	KSHV seropositivity for Kaposi's Sarcoma-Associated Herpesvirus	63
BIN	BIN23060	12	HBV_seropositivity_for_Hepatitis_B_Virus	HBV seropositivity for Hepatitis B Virus	40
BIN	BIN23061	1	HCV_seropositivity_for_Hepatitis_C_Virus	HCV seropositivity for Hepatitis C Virus	40
BIN	BIN23062	72	T._gondii_seropositivity_for_Toxoplasma_gondii	T. gondii seropositivity for Toxoplasma gondii	46
BIN	BIN23063	3	HTLV-1_seropositivity_for_Human_T-Lymphotropic_Virus_1	HTLV-1 seropositivity for Human T-Lymphotropic Virus 1	54
BIN	BIN23064	0	HIV-1_seropositivity_for_Human_Immunodeficiency_Virus	HIV-1 seropositivity for Human Immunodeficiency Virus	53
BIN	BIN23065	217	BKV_seropositivity_for_Human_Polyomavirus_BKV	BKV seropositivity for Human Polyomavirus BKV	45
BIN	BIN23066	139	JCV_seropositivity_for_Human_Polyomavirus_JCV	JCV seropositivity for Human Polyomavirus JCV	45
BIN	BIN23067	160	MCV_seropositivity_for_Merkel_Cell_Polyomavirus	MCV seropositivity for Merkel Cell Polyomavirus	47
BIN	BIN23068	10	HPV_16_Definition_I_seropositivity_for_Human_Papillomavirus_type-16	HPV 16 Definition I seropositivity for Human Papillomavirus type-16	67
BIN	BIN23069	8	HPV_18_seropositivity_for_Human_Papillomavirus_type-18	HPV 18 seropositivity for Human Papillomavirus type-18	54
BIN	BIN23070	62	C._trachomatis_Definition_I_seropositivity_for_Chlamydia_trachomatis	C. trachomatis Definition I seropositivity for Chlamydia trachomatis	68
BIN	BIN23071	6	C._trachomatis_Definition_II_seropositivity_for_Chlamydia_trachomatis	C. trachomatis Definition II seropositivity for Chlamydia trachomatis	69
BIN	BIN23073	38	H._pylori_Definition_I_seropositivity_for_Helicobacter_pylori	H. pylori Definition I seropositivity for Helicobacter pylori	61
BIN	BIN23074	72	H._pylori_Definition_II_seropositivity_for_Helicobacter_pylori	H. pylori Definition II seropositivity for Helicobacter pylori	62
BIN	BIN23075	13	HPV_16_Definition_II_seropositivity_for_Human_Papillomavirus_type-16	HPV 16 Definition II seropositivity for Human Papillomavirus type-16	68
BIN	BIN2316	2551	Wheeze_or_whistling_in_the_chest_in_last_year	Wheeze or whistling in the chest in last year	45
BIN	BIN2335	2207	Chest_pain_or_discomfort	Chest pain or discomfort	24
BIN	BIN2415	3168	Had_major_operations	Had major operations	20
BIN	BIN2443	779	Diabetes_diagnosed_by_doctor	Diabetes diagnosed by doctor	28
BIN	BIN2453	857	Cancer_diagnosed_by_doctor	Cancer diagnosed by doctor	26
BIN	BIN2463	1113	Fractured/broken_bones_in_last_5_years	Fractured/broken bones in last 5 years	38
BIN	BIN2473	2400	Other_serious_medical_condition/disability_diagnosed_by_doctor	Other serious medical condition/disability diagnosed by doctor	62
BIN	BIN2774	2478	Ever_had_stillbirth,_spontaneous_miscarriage_or_termination	Ever had stillbirth, spontaneous miscarriage or termination	59
BIN	BIN2814	2155	Ever_used_hormone-replacement_therapy_(HRT)	Ever used hormone-replacement therapy (HRT)	43
BIN	BIN30030510	591	UACR_higher_than_30_mg/g	UACR > 30 mg/g	14
BIN	BIN3081	6306	Foot_measured_for_bone_density	Foot measured for bone density	30
BIN	BIN3393	344	Hearing_aid_user	Hearing aid user	16
BIN	BIN3404	2101	Neck/shoulder_pain_for_3+_months	Neck/shoulder pain for 3+ months	32
BIN	BIN3414	977	Hip_pain_for_3+_months	Hip pain for 3+ months	22
BIN	BIN3571	2341	Back_pain_for_3+_months	Back pain for 3+ months	23
BIN_FC	BIN_FC10003571	2341	Back_pain_for_3+_months	Back pain for 3+ months	23
BIN	BIN3591	463	Ever_had_hysterectomy_(womb_removed)	Ever had hysterectomy (womb removed)	36
BIN	BIN3606	468	Chest_pain_or_discomfort_walking_normally	Chest pain or discomfort walking normally	41
BIN	BIN3616	597	Chest_pain_due_to_walking_ceases_when_standing_still	Chest pain due to walking ceases when standing still	52
BIN	BIN3741	715	Stomach/abdominal_pain_for_3+_months	Stomach/abdominal pain for 3+ months	36
BIN	BIN3751	424	Chest_pain_or_discomfort_when_walking_uphill_or_hurrying	Chest pain or discomfort when walking uphill or hurrying	56
BIN	BIN3773	2152	Knee_pain_for_3+_months	Knee pain for 3+ months	23
BIN	BIN3799	1206	Headaches_for_3+_months	Headaches for 3+ months	23
BIN	BIN4041	39	Gestational_diabetes_only	Gestational diabetes only	25
BIN	BIN4067	130	Facial_pains_for_3+_months	Facial pains for 3+ months	26
BIN	BIN4092	6096	Heel_ultrasound_method_(left)	Heel ultrasound method (L)	26
BIN	BIN4093	15	Fractured_heel_(left)	Fractured heel (L)	18
BIN	BIN4095	6102	Heel_ultrasound_method_(right)	Heel ultrasound method (R)	26
BIN	BIN4096	16	Fractured_heel_(right)	Fractured heel (R)	18
BIN	BIN41215	66	Detention_categories	Detention categories	20
BIN	BIN4232	6144	Hearing_test_triplet_correct_(left)	Hearing test triplet correct (L)	32
BIN	BIN4243	6146	Hearing_test_triplet_correct_(right)	Hearing test triplet correct (R)	32
BIN	BIN4598	3424	Ever_depressed_for_a_whole_week	Ever depressed for a whole week	31
BIN	BIN4631	2373	Ever_unenthusiastic/disinterested_for_a_whole_week	Ever unenthusiastic/disinterested for a whole week	50
BIN	BIN4642	539	Ever_manic/hyper_for_2_days	Ever manic/hyper for 2 days	27
BIN	BIN4653	1287	Ever_highly_irritable/argumentative_for_2_days	Ever highly irritable/argumentative for 2 days	46
BIN	BIN4728	1632	Leg_pain_on_walking	Leg pain on walking	19
BIN	BIN4792	5	Cochlear_implant	Cochlear implant	16
BIN	BIN5181	446	Ever_had_eye_surgery	Ever had eye surgery	20
BIN	BIN5324	123	Ever_had_cataract_surgery	Ever had cataract surgery	25
BIN	BIN5325	123	Ever_had_refractive_laser_eye_surgery	Ever had refractive laser eye surgery	37
BIN	BIN5326	6	Ever_had_surgery_for_glaucoma_or_high_eye_pressure	Ever had surgery for glaucoma or high eye pressure	50
BIN	BIN5327	15	Ever_had_laser_treatment_for_glaucoma_or_high_eye_pressure	Ever had laser treatment for glaucoma or high eye pressure	58
BIN	BIN5328	10	Ever_had_corneal_graft_surgery	Ever had corneal graft surgery	30
BIN	BIN5452	1049	Leg_pain_when_standing_still_or_sitting	Leg pain when standing still or sitting	39
BIN	BIN5463	589	Leg_pain_in_calf/calves	Leg pain in calf/calves	23
BIN	BIN5474	1106	Leg_pain_when_walking_uphill_or_hurrying	Leg pain when walking uphill or hurrying	40
BIN	BIN5485	908	Leg_pain_when_walking_normally	Leg pain when walking normally	30
BIN	BIN5496	311	Leg_pain_when_walking_ever_disappears_while_walking	Leg pain when walking ever disappears while walking	51
BIN	BIN5529	80	Surgery_on_leg_arteries_(other_than_for_varicose_veins)	Surgery on leg arteries (other than for varicose veins)	55
BIN	BIN5674	357	Severity_of_manic/irritable_episodes	Severity of manic/irritable episodes	36
BIN	BIN6014	164	Doctor_restricts_physical_activity_due_to_heart_condition	Doctor restricts physical activity due to heart condition	57
BIN	BIN6015	172	Chest_pain_felt_during_physical_activity	Chest pain felt during physical activity	40
BIN	BIN6016	142	Chest_pain_felt_outside_physical_activity	Chest pain felt outside physical activity	41
BIN	BIN6017	3649	Able_to_walk_or_cycle_unaided_for_10_minutes	Able to walk or cycle unaided for 10 minutes	44
BIN_FC	BIN_FC10000120	5653	Birth_weight_known_as_lb	Birth weight known as lb	24
BIN_FC	BIN_FC10001140	168	Did_not_use_mobile_phone_2_years_ago	Did not use mobile phone 2 years ago	36
BIN_FC	BIN_FC10001150	3624	Usual_side_of_head_for_mobile_phone_use_(left)	Usual side of head for mobile phone use (L)	43
BIN_FC	BIN_FC10001249	2720	Past_tobacco_smoking_(Smoked_on_most_or_all_days)	Past tobacco smoking (Smoked on most or all days)	49
BIN_FC	BIN_FC10001259	1309	Smoking/smokers_in_household	Smoking/smokers in household	28
BIN_FC	BIN_FC10001418	1115	Milk_type:_Full_cream	Milk type: Full cream	21
BIN_FC	BIN_FC10001428	1797	Spread_type:_Never/rarely_use_spread	Spread type: Never/rarely use spread	36
BIN_FC	BIN_FC10001448	2906	Bread_type:_White	Bread type: White	17
BIN_FC	BIN_FC10001468	1611	Cereal_type:_Bran_cereal_(e.g._All_Bran,_Branflakes)	Cereal type: Bran cereal (e.g. All Bran, Branflakes)	52
BIN_FC	BIN_FC10001508	1632	Coffee_type:_Decaffeinated_coffee_(any_type)	Coffee type: Decaffeinated coffee (any type)	44
BIN_FC	BIN_FC10001538	1503	Major_dietary_changes_in_the_last_5_years_becuase_of_illness	Major dietary changes in the last 5 years becuase of illness	60
BIN_FC	BIN_FC10001628	1632	Alcohol_intake_versus_10_years_previously_(More_nowadays)	Alcohol intake versus 10 years previously (More nowadays)	57
BIN_FC	BIN_FC10001707	10702	Handedness_(chirality/laterality)_(Right-handed)	Handedness (chirality/laterality) (Right-handed)	48
BIN_FC	BIN_FC10001727	3938	Ease_of_skin_tanning_(Get_very_tanned)	Ease of skin tanning (Get very tanned)	38
BIN_FC	BIN_FC10001757	8940	Facial_ageing_(Younger_than_you_are)	Facial ageing (Younger than you are)	36
BIN_FC	BIN_FC10001767	425	Adopted_as_a_child	Adopted as a child	18
BIN_FC	BIN_FC10001777	260	Part_of_a_multiple_birth	Part of a multiple birth	24
BIN_FC	BIN_FC10001787	2764	Maternal_smoking_around_birth	Maternal smoking around birth	29
BIN_FC	BIN_FC10001797	2920	Father_still_alive	Father still alive	18
BIN_FC	BIN_FC10001835	5241	Mother_still_alive	Mother still alive	18
BIN_FC	BIN_FC100020544	19	Bulimia_nervosa_diagnosed_by__a_professional	Bulimia nervosa diagnosed by  a professional	44
BIN_FC	BIN_FC10002159	582	Ever_had_same-sex_intercourse	Ever had same-sex intercourse	29
BIN_FC	BIN_FC10002227	2155	Other_eye_problems	Other eye problems	18
